### ISSUE TITLE
Only using UDP

### ISSUE THREAD

**Issue by Torstein-Eide** [arturpragacz/aioonkyo#4]
Hi
As described  in:

https://github.com/home-assistant/home-assistant.io/issues/43064#issuecomment-3756003464

Then run  under `Home Assistant` : `2026.1.0`, it only uses UDP not TCP as the [eISCP] spec says: 

> ## 1.2. ISCP over Ethernet (eISCP)	
> 	
> - Protocol is TCP(Transmission Control Protocol)	
> - Destination Port Number is 60128	
>    Please set the destination port number by the setup menu in the Receiver and turn off to stand-by once , If you need to change it from > default.

The AV-receiver  is on seperat subnet, but it shouldn't matter. 

### Home Assistant 

Start message
```
User Datagram Protocol, Src Port: 51054, Dst Port: 60128
    Source Port: 51054
    Destination Port: 60128
    Length: 35

Onkyo eISCP
    eISCP Header
        Magic Cookie: ISCP
        Header Size: 16
        Data Size: 11
        Version: 0x01
    Message: !xECNQSTN

```
and 

```
User Datagram Protocol, Src Port: 51054, Dst Port: 60128
    Source Port: 51054
    Destination Port: 60128
    Length: 35
Onkyo eISCP
    eISCP Header
        Magic Cookie: ISCP
        Header Size: 16
        Data Size: 11
        Version: 0x01
    Message: !pECNQSTN

```

It both odd that is `UDP` and use of   `!x` and `!p`.

### [onpc](https://github.com/mkulesh/onpc)

Start message: 
```
Frame 6: 247 bytes on wire (1976 bits), 247 bytes captured (1976 bits) on interface -, id 0
Ethernet II, Src: 5e:ab:92:85:4e:8f (5e:ab:92:85:4e:8f), Dst: OnkyoTechnol_f2:b8:f5 (00:09:b0:f2:b8:f5)
Internet Protocol Version 4, Src: 192.168.2.201, Dst: 192.168.10.23
Transmission Control Protocol, Src Port: 55849, Dst Port: 60128, Seq: 27, Ack: 1, Len: 181
Onkyo eISCP[1][NRI][QSTN]
    eISCP Header
        Magic Cookie: ISCP
        Header Size: 16
        Data Size: 10
        Version: 0x01
    Message: !1NRIQSTN
        Media Zone: 1
        Command Code: NRI
        Parameter Code: QSTN
Onkyo eISCP[1][NFN][QSTN]
    eISCP Header
        Magic Cookie: ISCP
        Header Size: 16
        Data Size: 10
        Version: 0x01
    Message: !1NFNQSTN
        Media Zone: 1
        Command Code: NFN
        Parameter Code: QSTN
Onkyo eISCP[1][NDN][QSTN]
    eISCP Header
        Magic Cookie: ISCP
        Header Size: 16
        Data Size: 10
        Version: 0x01
    Message: !1NDNQSTN
        Media Zone: 1
        Command Code: NDN
        Parameter Code: QSTN
Onkyo eISCP[1][system-po…][query]
    eISCP Header
        Magic Cookie: ISCP
        Header Size: 16
        Data Size: 10
        Version: 0x01
    Message: !1PWRQSTN
        Media Zone: 1
        Command Name: system-power
        Command Code: PWR
        Command description: System Power Command
        Parameter Name: query
        Parameter Code: QSTN
        Parameter description: gets the System Power Status
Onkyo eISCP[1][update][query]
    eISCP Header
        Magic Cookie: ISCP
        Header Size: 16
        Data Size: 10
        Version: 0x01
    Message: !1UPDQSTN
        Media Zone: 1
        Command Name: update
        Command Code: UPD
        Command description: Update
        Parameter Name: query
        Parameter Code: QSTN
        Parameter description: gets exist new firmware
Onkyo eISCP[1][NGV][QSTN]
    eISCP Header
        Magic Cookie: ISCP
        Header Size: 16
        Data Size: 10
        Version: 0x01
    Message: !1NGVQSTN
        Media Zone: 1
        Command Code: NGV
        Parameter Code: QSTN
Onkyo eISCP[1][Net Jacke…][REQ]
    eISCP Header
        Magic Cookie: ISCP
        Header Size: 16
        Data Size: 9
        Version: 0x01
    Message: !1NJAREQ
        Media Zone: 1
        Command Name: Net Jacket Art
        Command Code: NJA
        Command description: Albumcover-data over nettverk
        Parameter Name: Uknown Parameter
        Parameter Code: REQ

```

**Comment by Torstein-Eide** [comment]
I am not following, why we are marking it as completed.

How can we troubleshoot the issue.
